<?xml version="1.0" encoding="utf-8" ?>
<!-- namespace -->
<xs:schema xmlns:xs="http://www.w3.org/2001/XMLSchema"
targetNamespace="https://www.w3schools.com"
xmlns="https://www.w3schools.com"
elementFormDefault="qualified">

<xs:element name="employees">
	<xs:complexType>
		<!-- define that employees info should always come in sequence --> 
		<xs:sequence>
			<xs:element name="employee" minOccurs="0" maxOccurs="unbounded"></xs:element>
		</xs:sequence>
	</xs:complexType>	
</xs:element>

<xs:element>
	<xs:complexType>
		<xs:all>
			<xs:element name="firstname" type="xs:string"></xs:element>
			<xs:element name="lastname" type="xs:string"></xs:element>
			<xs:element name="email" type="xs:string"></xs:element>
		</xs:all>
	</xs:complexType>
</xs:element>

<xs:element name="phone" > 
	<xs:complexType>
		<xs:attribute name="type" use="required">
			<xs:simpleType>
				<xs:restriction base="xs:string"> <!-- restriction: string should be equal to either work or mobile -->
					<xs:enumeration value="work"></xs:enumeration>
					<xs:enumeration value="mobile"></xs:enumeration>
				</xs:restriction>
			</xs:simpleType>
		</xs:attribute>
	</xs:complexType>
</xs:element>

</xs:schema>